{
  "schemaVersion": "buildlore.profile.v1",
  "profileId": "buildlore-lifecycle",
  "profileVersion": "0.1.0",
  "outputLanguage": "en",
  "entities": [
    {
      "id": "decision",
      "upstreamType": "decisions",
      "directory": "wiki/decisions"
    },
    {
      "id": "failure",
      "upstreamType": "failures",
      "directory": "wiki/failures"
    },
    {
      "id": "verification",
      "upstreamType": "verifications",
      "directory": "wiki/verifications"
    }
  ],
  "relations": [
    {
      "id": "supersedes",
      "from": [
        "decisions"
      ],
      "to": [
        "decisions"
      ],
      "direction": "directed",
      "cardinality": {
        "from": "0..n",
        "to": "0..n"
      }
    },
    {
      "id": "verified-by",
      "from": [
        "decisions",
        "failures"
      ],
      "to": [
        "verifications"
      ],
      "direction": "directed",
      "cardinality": {
        "from": "0..n",
        "to": "0..n"
      }
    }
  ],
  "lifecycles": [
    {
      "entity": "decisions",
      "field": "status",
      "initial": "active",
      "terminal": [
        "archived"
      ],
      "transitions": {
        "active": [
          "superseded",
          "archived"
        ],
        "superseded": [
          "archived"
        ],
        "archived": []
      }
    },
    {
      "entity": "failures",
      "field": "status",
      "initial": "open",
      "terminal": [
        "archived"
      ],
      "transitions": {
        "open": [
          "resolved"
        ],
        "resolved": [
          "archived"
        ],
        "archived": []
      }
    },
    {
      "entity": "verifications",
      "field": "status",
      "initial": "recorded",
      "terminal": [
        "archived"
      ],
      "transitions": {
        "recorded": [
          "passed",
          "failed"
        ],
        "passed": [
          "archived"
        ],
        "failed": [
          "archived"
        ],
        "archived": []
      }
    }
  ],
  "reviewPolicy": {
    "hold": [
      "low-confidence",
      "contradicted",
      "schema-violating",
      "provenance-violating"
    ],
    "lowConfidenceThreshold": 0.5,
    "treatMissingConfidenceAs": "low"
  },
  "freshnessPolicy": {
    "stale": "retain-warn-recompile",
    "orphaned": "retain-review-exclude-active",
    "archived": "retain-history-exclude-active"
  },
  "exclusions": {
    "entities": [
      "project",
      "feature",
      "task",
      "run",
      "artifact"
    ],
    "relations": [
      "implements",
      "failed-by",
      "produced",
      "belongs-to"
    ],
    "workflows": [
      "generic-workflow",
      "workflow-actions",
      "artifacts",
      "connectors"
    ]
  }
}
